{
  "$id": "schemas/html-validate-config.schema.json",
  "$schema": "http://json-schema.org/draft-07/schema#",
  "title": "HTML-Validate configuration",
  "type": "object",
  "additionalProperties": true,
  "properties": {
    "$schema": { "type": "string" },
    "extends": {
      "oneOf": [{ "type": "string" }, { "type": "array", "items": { "type": "string" } }]
    },
    "elements": {
      "oneOf": [
        { "type": "string" },
        { "type": "array", "items": { "type": "string" } },
        { "type": "object", "additionalProperties": true }
      ]
    },
    "plugins": {
      "type": "array",
      "items": { "type": "string" }
    },
    "rules": {
      "type": "object",
      "additionalProperties": {
        "oneOf": [
          { "type": "string", "enum": ["off", "warn", "error"] },
          {
            "type": "array",
            "minItems": 1,
            "items": [{ "type": "string", "enum": ["off", "warn", "error"] }, { "type": "object" }],
            "additionalItems": true
          }
        ]
      }
    },
    "root": { "type": "boolean" },
    "specs": { "type": "array", "items": { "type": "string" } },
    "transform": { "type": "object", "additionalProperties": true }
  }
}
